video_link,duration,title,views,likes,comments,date,month,year,date_month_year,day
https://www.youtube.com//watch?v=hU-aTB-heU0,11,The fundamental right to seek asylum | Melanie Nezer,41697,1100,665,28,8,2019,28/8/2019,Wed
https://www.youtube.com//watch?v=xgW-0egOWVg,16,The fascinating (and dangerous) places scientists aren't exploring | Ella Al-Shamahi,136334,4100,259,27,8,2019,27/8/2019,Tue
https://www.youtube.com//watch?v=2IFa0tqHrwE,14,"Mentalism, mind reading and the art of getting inside your head | Derren Brown",1309321,27000,2027,26,8,2019,26/8/2019,Mon
https://www.youtube.com//watch?v=JKS7HWy2TRU,12,How film transforms the way we see the world | Sharmeen Obaid-Chinoy,95997,3500,124,24,8,2019,24/8/2019,Sat
https://www.youtube.com//watch?v=L1VT0asH5Ck,16,A vision for the future of Sierra Leone | Julius Maada Bio,88037,1700,211,22,8,2019,22/8/2019,Thu
https://www.youtube.com//watch?v=xlLXXdU0FBk,11,How we're honoring people overlooked by history | Amy Padnani,42746,1100,177,20,8,2019,20/8/2019,Tue
https://www.youtube.com//watch?v=DTIjvPLkJgo,12,Origami robots that reshape and transform themselves | Jamie Paik,202652,7000,398,16,8,2019,16/8/2019,Fri
https://www.youtube.com//watch?v=Q9XD8yRPxc8,16,The future of psychedelic-assisted psychotherapy | Rick Doblin,328639,12000,1166,9,8,2019,9/8/2019,Fri
https://www.youtube.com//watch?v=Bg7hbA6IwBM,11,How education helped me rewrite my life | Ashweetha Shetty,127322,4600,214,7,8,2019,7/8/2019,Wed
https://www.youtube.com//watch?v=Ta8KBJ4BTNg,5,The world's first crowdsourced space traffic monitoring system | Moriba Jah,50075,1300,72,6,8,2019,6/8/2019,Tue
https://www.youtube.com//watch?v=OQuwz64qsBM,8,Why kids need to learn about gender and sexuality | Lindsay Amer,192968,5100,3062,5,8,2019,5/8/2019,Mon
https://www.youtube.com//watch?v=UuskKfv2zxI,8,What's at the bottom of the ocean -- and how we're getting there | Victor Vescovo,304786,9600,676,3,8,2019,3/8/2019,Sat
https://www.youtube.com//watch?v=ORW5MNCv_LU,7,How augmented reality is changing activism | Glenn Cantave,45387,1100,230,2,8,2019,2/8/2019,Fri
https://www.youtube.com//watch?v=Rp_HEnOWEso,15,Grief and love in the animal kingdom | Barbara J. King,74506,2300,154,1,8,2019,1/8/2019,Thu
https://www.youtube.com//watch?v=xJM_CQN8-ns,6,3 ways to measure your adaptability -- and how to improve it | Natalie Fratto,243023,5500,166,31,7,2019,31/7/2019,Wed
https://www.youtube.com//watch?v=5cWkKwGUt3g,10,"The next big thing is coming from the Bronx, again | Jon Gray",70712,2000,186,31,7,2019,31/7/2019,Wed
https://www.youtube.com//watch?v=R9XKRR7aKHI,11,The story we tell about millennials -- and who we leave out | Reniqua Allen,85496,1400,383,29,7,2019,29/7/2019,Mon
https://www.youtube.com//watch?v=gi6rMXu_veE,10,You are not alone in your loneliness | Jonny Sun,366108,10000,461,26,7,2019,26/7/2019,Fri
https://www.youtube.com//watch?v=h-TIRIxhq6E,12,"How to ask for help -- and get a ""yes"" | Heidi Grant",130802,3600,150,25,7,2019,25/7/2019,Thu
https://www.youtube.com//watch?v=zELJMIQawys,7,Why we need to fight misinformation about vaccines | Ethan Lindenberger,84352,2400,931,24,7,2019,24/7/2019,Wed
https://www.youtube.com//watch?v=54ST8bwOVyc,5,"""A Bird Made of Birds"" | Sarah Kay",210601,9900,270,23,7,2019,23/7/2019,Tue
https://www.youtube.com//watch?v=oBdzOIzwtng,16,The living tech we need to support human life on other planets | Lynn Rothschild,48750,1300,212,22,7,2019,22/7/2019,Mon
https://www.youtube.com//watch?v=PUW89NpDYJw,14,How a typeface helped launch Apollo | Douglas Thomas,56779,1600,110,20,7,2019,20/7/2019,Sat
https://www.youtube.com//watch?v=Stt4iGMiHiI,4,Architectural secrets of the world's ancient wonders | Brandon Clifford,112353,2500,234,19,7,2019,19/7/2019,Fri
https://www.youtube.com//watch?v=m5HQamrXlSY,17,What almost dying taught me about living | Suleika Jaouad,417433,10000,378,18,7,2019,18/7/2019,Thu
https://www.youtube.com//watch?v=8DDgHq9ewOo,16,How synthetic biology could wipe out humanity -- and how we can stop it | Rob Reid,166641,5400,690,17,7,2019,17/7/2019,Wed
https://www.youtube.com//watch?v=PJLT0cAPNfs,10,5 challenges we could solve by designing new proteins | David Baker,104025,3800,253,17,7,2019,17/7/2019,Wed
https://www.youtube.com//watch?v=srhCnPUmJDI,17,The political power of being a good neighbor | Michael Tubbs,50021,1500,135,16,7,2019,16/7/2019,Tue
https://www.youtube.com//watch?v=ppfONdsOkWI,10,3 steps to turn everyday get-togethers into transformative gatherings | Priya Parker,110302,2800,100,15,7,2019,15/7/2019,Mon
https://www.youtube.com//watch?v=A2DzsgJSwcc,14,The mysterious microbes living deep inside the earth -- and how they could help humanity | K. Lloyd,110373,4000,252,12,7,2019,12/7/2019,Fri
https://www.youtube.com//watch?v=0rAngiiXBAc,13,Why we get mad -- and why it's healthy | Ryan Martin,288095,7800,510,11,7,2019,11/7/2019,Thu
https://www.youtube.com//watch?v=88d-58tWhGs,14,"The most detailed map of galaxies, black holes and stars ever made | Juna Kollmeier",377427,8900,973,10,7,2019,10/7/2019,Wed
https://www.youtube.com//watch?v=UCKfvxnljYY,18,The healing power of reading | Michelle Kuo,211659,6400,223,9,7,2019,9/7/2019,Tue
https://www.youtube.com//watch?v=iB4MS1hsWXU,15,The lies our culture tells us about what matters --- and a better way to live | David Brooks,1958227,40000,2583,3,7,2019,3/7/2019,Wed
https://www.youtube.com//watch?v=DTcJmIbn5nw,15,"""Everything happens for a reason"" -- and other lies I've loved | Kate Bowler",3938052,100000,2789,2,7,2019,2/7/2019,Tue
https://www.youtube.com//watch?v=ieSV8-isy3M,15,"Floating cities, the LEGO House and other architectural forms of the future | Bjarke Ingels",581741,32000,961,1,7,2019,1/7/2019,Mon
https://www.youtube.com//watch?v=ogCIqaCe2zI,13,The amazing brains and morphing skin of octopuses and other cephalopods | Roger Hanlon,243945,6500,290,28,6,2019,28/6/2019,Fri
https://www.youtube.com//watch?v=aVOJA8qI7oo,7,What it takes to launch a telescope | Erika Hamden,39710,1500,96,27,6,2019,27/6/2019,Thu
https://www.youtube.com//watch?v=RZgkjEdMbSw,17,"How to deconstruct racism, one headline at a time | Baratunde Thurston",1311755,70000,7244,26,6,2019,26/6/2019,Wed
https://www.youtube.com//watch?v=jATCr-gQvPA,12,What prosecutors and incarcerated people can learn from each other | Jarrell Daniels,40166,1300,71,25,6,2019,25/6/2019,Tue
https://www.youtube.com//watch?v=nbW4XWkJC6w,9,These bacteria eat plastic | Morgan Vague,144762,5600,593,25,6,2019,25/6/2019,Tue
https://www.youtube.com//watch?v=RjquHTj4HlY,14,America Ferrera: My identity is a superpower -- not an obstacle | TED,480637,11000,676,21,6,2019,21/6/2019,Fri
https://www.youtube.com//watch?v=SGTMSV8QUrs,17,The anti-CEO playbook | Hamdi Ulukaya,280090,8100,416,20,6,2019,20/6/2019,Thu
https://www.youtube.com//watch?v=vZCGSP3A0Fo,6,The next global agricultural revolution | Bruce Friedrich,122607,4300,476,19,6,2019,19/6/2019,Wed
https://www.youtube.com//watch?v=m19jit19v9w,14,Sloths! The strange life of the world's slowest mammal | Lucy Cooke,107650,4400,189,18,6,2019,18/6/2019,Tue
https://www.youtube.com//watch?v=b5ZESpOAolU,13,How to build your confidence -- and spark it in others | Brittany Packnett Cunningham,936202,22000,366,17,6,2019,17/6/2019,Mon
https://www.youtube.com//watch?v=pyFcr2WcOyo,14,How supercharged plants could slow climate change | Joanne Chory,103629,4700,508,15,6,2019,15/6/2019,Sat
https://www.youtube.com//watch?v=8q7D4EmbSCw,9,My life as a work of art | Daniel Lismore,91822,3200,211,13,6,2019,13/6/2019,Thu
https://www.youtube.com//watch?v=87qLWFZManA,18,Three ideas. Three contradictions. Or not. | Hannah Gadsby,1175470,46000,2352,13,6,2019,13/6/2019,Thu
https://www.youtube.com//watch?v=ON4iy8hq2hM,12,The difference between healthy and unhealthy love | Katie Hood,3546031,104000,2132,12,6,2019,12/6/2019,Wed
https://www.youtube.com//watch?v=OQSMr-3GGvQ,15,Facebook's role in Brexit — and the threat to democracy | Carole Cadwalladr,1038422,27000,3964,10,6,2019,10/6/2019,Mon
https://www.youtube.com//watch?v=ttcJMNlKif4,5,An ingenious proposal for scaling up marine protection | The Nature Conservancy,114641,5000,200,8,6,2019,8/6/2019,Sat
https://www.youtube.com//watch?v=BcgDvEdGEXg,26,How Twitter needs to change | Jack Dorsey,168983,2600,915,7,6,2019,7/6/2019,Fri
https://www.youtube.com//watch?v=TrofjEAetVs,9,How AI could become an extension of your mind | Arnav Kapur,133346,4600,508,6,6,2019,6/6/2019,Thu
https://www.youtube.com//watch?v=a63t8r70QN0,14,What you should know about vaping and e-cigarettes | Suchitra Krishnan-Sarin,296613,4100,1815,5,6,2019,5/6/2019,Wed
https://www.youtube.com//watch?v=4CGFPbFqdJ4,11,Could a tattoo help you stay healthy? | Carson Bruns,114541,5600,270,5,6,2019,5/6/2019,Wed
https://www.youtube.com//watch?v=5MuIMqhT8DM,19,Sleep is your superpower | Matt Walker,7440336,207000,7694,3,6,2019,3/6/2019,Mon
https://www.youtube.com//watch?v=Cm1Ij-jRhpQ,13,The case for having kids | Wajahat Ali,111829,3500,1193,31,5,2019,31/5/2019,Fri
https://www.youtube.com//watch?v=qAC-5hTK-4c,9,How your brain's executive function works -- and how to improve it | Sabine Doebel,255381,6200,304,31,5,2019,31/5/2019,Fri
https://www.youtube.com//watch?v=gmG5ADvPN98,14,The crisis of leadership — and a new way forward | Halla Tómasdóttir and Bryn Freedman,54368,1100,199,29,5,2019,29/5/2019,Wed
https://www.youtube.com//watch?v=nJd_2mJ4u-I,12,Digital humans that look just like us | Doug Roble,125967,4800,502,28,5,2019,28/5/2019,Tue
https://www.youtube.com//watch?v=iqKYtA3pK1c,14,How to revive your belief in democracy | Eric Liu,73989,1900,526,25,5,2019,25/5/2019,Sat
https://www.youtube.com//watch?v=DBBA2LAsepU,10,Why we ignore obvious problems — and how to act on them | Michele Wucker,108702,2400,121,23,5,2019,23/5/2019,Thu
https://www.youtube.com//watch?v=LC5n91vKDZg,8,How to recover from activism burnout | Yana Buhrer Tavanier,46660,1100,218,22,5,2019,22/5/2019,Wed
https://www.youtube.com//watch?v=ONs9FCY74p0,16,Can we cure genetic diseases by rewriting DNA? | David R. Liu,193841,6800,466,21,5,2019,21/5/2019,Tue
https://www.youtube.com//watch?v=lUKhMUZnLuw,14,Helping others makes us happier -- but it matters how we do it | Elizabeth Dunn,240925,5800,234,20,5,2019,20/5/2019,Mon
https://www.youtube.com//watch?v=fO2htapfNhA,12,The surprising connection between brain injuries and crime | Kim Gorgens,89562,2100,202,17,5,2019,17/5/2019,Fri
https://www.youtube.com//watch?v=dKNu5ZnWhb4,11,How generational stereotypes hold us back at work | Leah Georges,124911,2800,225,16,5,2019,16/5/2019,Thu
https://www.youtube.com//watch?v=J4r9pgx_95E,5,A personal air-quality tracker that lets you know what you're breathing | Romain Lacombe,43314,1500,213,16,5,2019,16/5/2019,Thu
https://www.youtube.com//watch?v=Ln5Ts0bGguk,8,How hip-hop helps us understand science | Danielle N. Lee,44745,1100,188,14,5,2019,14/5/2019,Tue
https://www.youtube.com//watch?v=uyMtsyzXWd4,11,Inside the black hole image that made history | Sheperd Doeleman,2843268,66000,4465,10,5,2019,10/5/2019,Fri
https://www.youtube.com//watch?v=vjXJ4f-OW0U,13,Everything around you can become a computer | Ivan Poupyrev,128873,3900,269,8,5,2019,8/5/2019,Wed
https://www.youtube.com//watch?v=ER15KmrB8h8,11,The artificial muscles that will power robots of the future | Christoph Keplinger,148741,7500,376,7,5,2019,7/5/2019,Tue
https://www.youtube.com//watch?v=qu47T7kUPVQ,11,3 lessons on starting a movement from a self-defense trailblazer | Rana Abdelhamid,48852,1100,249,6,5,2019,6/5/2019,Mon
https://www.youtube.com//watch?v=CeOadxT7kPA,17,Mind-blowing stage sculptures that fuse music and technology | Es Devlin,195220,3200,98,4,5,2019,4/5/2019,Sat
https://www.youtube.com//watch?v=RLz3AYVIqes,6,What refugees need to start new lives | Muhammed Idris,44676,1100,374,3,5,2019,3/5/2019,Fri
https://www.youtube.com//watch?v=C0dmOPDLKhY,14,Can we regenerate heart muscle with stem cells? | Chuck Murry,48671,1700,112,2,5,2019,2/5/2019,Thu
https://www.youtube.com//watch?v=5nM21P8lJ2I,12,"Empower a girl, transform a community | Kakenya Ntaiya",39151,1500,211,1,5,2019,1/5/2019,Wed
https://www.youtube.com//watch?v=qRJJR6bGyL4,6,A short history of trans people's long fight for equality | Samy Nour Younes,71066,3100,597,30,4,2019,30/4/2019,Tue
https://www.youtube.com//watch?v=VLDwh4ivNf4,11,How risk-taking changes a teenager's brain | Kashfia Rahman,153037,4000,297,29,4,2019,29/4/2019,Mon
https://www.youtube.com//watch?v=xnQB9Y77PXE,6,Wearable tech that helps you navigate by touch | Keith Kirkland,44422,1300,68,26,4,2019,26/4/2019,Fri
https://www.youtube.com//watch?v=khkJkR-ipfw,15,"We don't ""move on"" from grief. We move forward with it | Nora McInerny",998853,33000,1597,25,4,2019,25/4/2019,Thu
https://www.youtube.com//watch?v=YkYdxjaqt58,16,An AI smartwatch that detects seizures | Rosalind Picard,44978,1300,121,24,4,2019,24/4/2019,Wed
https://www.youtube.com//watch?v=QtnBMSSk9Ok,10,What it's like to have Tourette's — and how music gives me back control | Esha Alwani,104150,4100,358,23,4,2019,23/4/2019,Tue
https://www.youtube.com//watch?v=3BDF7cD2M6g,9,How to lead a conversation between people who disagree | Eve Pearlman,151665,2600,155,22,4,2019,22/4/2019,Mon
https://www.youtube.com//watch?v=HiA41B9LbJI,12,"To detect diseases earlier, let's speak bacteria's secret language | Fatima AlZahra'a Alatraktchi",66766,2700,218,19,4,2019,19/4/2019,Fri
https://www.youtube.com//watch?v=xTra-yePY_A,12,How does income affect childhood brain development? | Kimberly Noble,100258,2300,436,18,4,2019,18/4/2019,Thu
https://www.youtube.com//watch?v=-jNlpGLpelg,13,How centuries of sci-fi sparked spaceflight | Alex MacDonald,49038,1600,149,18,4,2019,18/4/2019,Thu
https://www.youtube.com//watch?v=tt2xKhTHZQs,5,A new class of drug that could prevent depression and PTSD | Rebecca Brachman,91551,3000,510,18,4,2019,18/4/2019,Thu
https://www.youtube.com//watch?v=hxnHdLQIX3o,13,Creative ways to get kids to thrive in school | Olympia Della Flora,68923,1800,101,15,4,2019,15/4/2019,Mon
https://www.youtube.com//watch?v=BRRNeBKwvNM,12,How to keep human bias out of AI | Kriti Sharma,85171,1800,308,13,4,2019,13/4/2019,Sat
https://www.youtube.com//watch?v=XY6aAPhs0tE,11,The secret to scientific discoveries? Making mistakes | Phil Plait,99663,2900,128,11,4,2019,11/4/2019,Thu
https://www.youtube.com//watch?v=WlFsUeYzezk,13,"How you can help save the bees, one hive at a time | Noah Wilson-Rich",58296,2100,138,10,4,2019,10/4/2019,Wed
https://www.youtube.com//watch?v=MeKJK4uetL8,11,An unexpected tool for understanding inequality: abstract math | Eugenia Cheng,87398,1700,421,9,4,2019,9/4/2019,Tue
https://www.youtube.com//watch?v=YSZhrxOkBZI,10,"The ""dementia village"" that's redefining elder care | Yvonne van Amerongen",77254,2000,94,8,4,2019,8/4/2019,Mon
https://www.youtube.com//watch?v=nAHvKC_k5VE,12,Art that transforms cities into playgrounds of the imagination | Helen Marriage,44510,1400,61,6,4,2019,6/4/2019,Sat
https://www.youtube.com//watch?v=Ox4YJsGm8mY,9,"""East Virginia"" / ""John Brown's Dream"" | Nora Brown",50093,1300,80,5,4,2019,5/4/2019,Fri
https://www.youtube.com//watch?v=XXllBMHeKJE,13,The most powerful woman you've never heard of | T. Morgan Dixon and Vanessa Garrison,53892,1500,107,4,4,2019,4/4/2019,Thu
https://www.youtube.com//watch?v=CyGWML6cI_k,13,A bold idea to replace politicians | César Hidalgo,381295,14000,2934,4,4,2019,4/4/2019,Thu
https://www.youtube.com//watch?v=UUp39T3fPAo,15,Una idea osada para reemplazar a los políticos | César Hidalgo,28783,808,82,4,4,2019,4/4/2019,Thu
https://www.youtube.com//watch?v=TdZTvzMPa6s,11,How I'm making bricks out of ashes and rubble in Gaza | Majd Mashharawi,50070,2400,386,2,4,2019,2/4/2019,Tue
https://www.youtube.com//watch?v=lFG1b1-EsW8,15,Our dangerous obsession with perfectionism is getting worse | Thomas Curran,193397,5700,284,1,4,2019,1/4/2019,Mon
https://www.youtube.com//watch?v=5tn8zo4ykMI,11,Is your country at risk of becoming a dictatorship? Here's how to know | Farida Nabourema,80810,3100,474,30,3,2019,30/3/2019,Sat
https://www.youtube.com//watch?v=-mwF-znI4x0,17,What happens in your throat when you beatbox? | Tom Thum and Matthew Broadhurst,115416,3800,180,28,3,2019,28/3/2019,Thu
https://www.youtube.com//watch?v=FJxUN-kNXNs,16,A juror's reflections on the death penalty | Lindy Lou Isonhood,52772,1400,237,27,3,2019,27/3/2019,Wed
https://www.youtube.com//watch?v=7uRPPaYuu44,11,Where did the Moon come from? A new theory | Sarah T. Stewart,825142,11000,4483,26,3,2019,26/3/2019,Tue
https://www.youtube.com//watch?v=zjrFw3MASGc,11,Ronald Rael: An architect's subversive reimagining of the US-Mexico border wall | TED,41232,1300,265,25,3,2019,25/3/2019,Mon
https://www.youtube.com//watch?v=_lyP_2p5MJc,9,The beautiful future of solar power | Marjan van Aubel,187043,6000,435,23,3,2019,23/3/2019,Sat
https://www.youtube.com//watch?v=SkB4gG8ke7Q,11,The uncomplicated truth about women's sexuality | Sarah Barmak,201077,4200,556,22,3,2019,22/3/2019,Fri
https://www.youtube.com//watch?v=wxStlzunxCw,13,How we can store digital data in DNA | Dina Zielinski,98038,3200,273,21,3,2019,21/3/2019,Thu
https://www.youtube.com//watch?v=Bzfb4ZdNQFM,0,Get TED Talks recommended just for you,18978,182,7,21,3,2019,21/3/2019,Thu
https://www.youtube.com//watch?v=gJjLdnycuyU,40,The creative power of misfits | WorkLife with Adam Grant (Audio only),53731,1000,46,20,3,2019,20/3/2019,Wed
https://www.youtube.com//watch?v=SMnKboI4fvY,13,Amanda Williams: Why I turned Chicago's abandoned homes into art | TED,27521,886,75,20,3,2019,20/3/2019,Wed
https://www.youtube.com//watch?v=xv4_L5zlYaA,11,How a new species of ancestors is changing our theory of human evolution | Juliet Brophy,294598,5900,1152,20,3,2019,20/3/2019,Wed
https://www.youtube.com//watch?v=Q9cje57YDRU,13,How to overcome apathy and find your power | Dolores Huerta,94149,2300,256,19,3,2019,19/3/2019,Tue
https://www.youtube.com//watch?v=G9-urSR19SI,12,How to teach kids to talk about taboo topics | Liz Kleinrock,126146,3700,240,15,3,2019,15/3/2019,Fri
https://www.youtube.com//watch?v=-kHm6YiboHA,13,"How we can help the ""forgotten middle"" reach their full potential | Danielle R. Moss",41516,967,94,14,3,2019,14/3/2019,Thu
https://www.youtube.com//watch?v=F3mzS32SH2Q,12,The self-assembling computer chips of the future | Karl Skjonnemand,99997,2400,191,13,3,2019,13/3/2019,Wed
https://www.youtube.com//watch?v=7SfhKi24z-M,20,Ruby Sales: How we can start to heal the pain of racial division | TED,37366,865,440,12,3,2019,12/3/2019,Tue
https://www.youtube.com//watch?v=ZjeZ8r7yWOk,7,What if all US health care costs were transparent? | Jeanne Pinder,391575,12000,2659,11,3,2019,11/3/2019,Mon
https://www.youtube.com//watch?v=GIBoCJeB3HQ,14,How women in Pakistan are creating political change | Shad Begum,60660,1600,263,8,3,2019,8/3/2019,Fri
https://www.youtube.com//watch?v=fjkTrdunJzA,11,How do we find dignity at work? | Roy Bahat and Bryn Freedman,74274,1300,130,7,3,2019,7/3/2019,Thu
https://www.youtube.com//watch?v=stUl_OapUso,14,The way we think about biological sex is wrong | Emily Quinn,418132,17000,1814,6,3,2019,6/3/2019,Wed
https://www.youtube.com//watch?v=kcoUlel8qbw,12,Aja Monet and phillip agnew: A love story about the power of art as organizing | TED,34644,885,93,5,3,2019,5/3/2019,Tue
https://www.youtube.com//watch?v=Vn6elsrKz70,14,3 ways to practice civility | Steven Petrow,63431,1300,237,4,3,2019,4/3/2019,Mon
https://www.youtube.com//watch?v=-T3k6s7bev8,18,The age of genetic wonder | Juan Enriquez,121761,3600,294,2,3,2019,2/3/2019,Sat
https://www.youtube.com//watch?v=wMt0K-AbpCU,12,The power of women's anger | Soraya Chemaly,164786,5400,325,28,2,2019,28/2/2019,Thu
https://www.youtube.com//watch?v=jr5mTwfFh00,10,How doctors can help low-income patients (and still make a profit) | P.J. Parmar,54665,2100,199,27,2,2019,27/2/2019,Wed
https://www.youtube.com//watch?v=ewNTwBbLUhM,10,Why noise is bad for your health -- and what you can do about it | Mathias Basner,136710,3400,325,27,2,2019,27/2/2019,Wed
https://www.youtube.com//watch?v=aQsOmGflf1o,13,What your breath could reveal about your health | Julian Burschka,93484,2100,137,25,2,2019,25/2/2019,Mon
https://www.youtube.com//watch?v=Swj-8DrVT2M,17,The political progress women have made — and what's next | Cecile Richards,50556,1200,154,22,2,2019,22/2/2019,Fri
https://www.youtube.com//watch?v=Xj-ncWb4N-I,10,How do we learn to work with intelligent machines? | Matt Beane,62532,1100,90,22,2,2019,22/2/2019,Fri
https://www.youtube.com//watch?v=jTVWtrMleI0,15,Reflections from a lifetime fighting to end child poverty | Marian Wright Edelman,37315,926,62,20,2,2019,20/2/2019,Wed
https://www.youtube.com//watch?v=McxUiTl61nY,13,"An astronaut's story of curiosity, perspective and change | Leland Melvin",82036,1900,128,19,2,2019,19/2/2019,Tue
https://www.youtube.com//watch?v=vXlJEcrinwg,14,How empowering women and girls can help stop global warming | Katharine Wilkinson,97800,2200,238,15,2,2019,15/2/2019,Fri
https://www.youtube.com//watch?v=NI915VTjCHE,17,"Embrace your raw, strange magic | Casey Gerald",71227,2100,139,14,2,2019,14/2/2019,Thu
https://www.youtube.com//watch?v=H2QxFM9y0tY,11,The disarming case to act right now on climate change | Greta Thunberg,2217337,61000,8386,13,2,2019,13/2/2019,Wed
https://www.youtube.com//watch?v=08z_xW-szwM,10,Can we solve global warming? Lessons from how we protected the ozone layer | Sean Davis,166376,3800,459,13,2,2019,13/2/2019,Wed
https://www.youtube.com//watch?v=PK8PR22-c_U,11,What's needed to bring the US voting system into the 21st century | Tiana Epps-Johnson,47868,998,364,12,2,2019,12/2/2019,Tue
https://www.youtube.com//watch?v=HLEgiR1Fsds,13,"The biology of gender, from DNA to the brain | Karissa Sanbonmatsu",279096,5700,590,12,2,2019,12/2/2019,Tue
https://www.youtube.com//watch?v=dQmaMOxwaQI,12,How to transform sinking cities into landscapes that fight floods | Kotchakorn Voraakhom,105163,2600,119,11,2,2019,11/2/2019,Mon
https://www.youtube.com//watch?v=mCHC99MqVfE,4,"Why you should bring your whole self to work | The Way We Work, a TED series",146062,1900,78,9,2,2019,9/2/2019,Sat
https://www.youtube.com//watch?v=x6fIseKzzH0,4,"Why working from home is good for business | The Way We Work, a TED series",316105,4800,163,9,2,2019,9/2/2019,Sat
https://www.youtube.com//watch?v=DOisAG9yoNk,6,"3 psychological tricks to help you save money | The Way We Work, a TED series",309638,5000,98,9,2,2019,9/2/2019,Sat
https://www.youtube.com//watch?v=PYJ22-YYNW8,4,"This is what makes employees happy at work | The Way We Work, a TED series",587061,9500,178,9,2,2019,9/2/2019,Sat
https://www.youtube.com//watch?v=ngFXRh3ahm8,3,"This is the side hustle revolution | The Way We Work, a TED series",126323,1400,30,9,2,2019,9/2/2019,Sat
https://www.youtube.com//watch?v=UJz69v_7258,5,"How to make applying for jobs less painful | The Way We Work, a TED series",127535,1500,62,9,2,2019,9/2/2019,Sat
https://www.youtube.com//watch?v=H8rDS6Wto5g,6,"7 common questions about workplace romance | The Way We Work, a TED series",275170,3100,187,9,2,2019,9/2/2019,Sat
https://www.youtube.com//watch?v=iBa9EoEbb38,5,"8 lessons on building a company people enjoy working for | The Way We Work, a TED series",507719,10000,248,9,2,2019,9/2/2019,Sat
https://www.youtube.com//watch?v=Dig_QFPPPtE,8,Ink made of air pollution | Anirudh Sharma,107978,5200,262,8,2,2019,8/2/2019,Fri
https://www.youtube.com//watch?v=yjYrxcGSWX4,17,A powerful way to unleash your natural creativity | Tim Harford,449944,15000,501,7,2,2019,7/2/2019,Thu
https://www.youtube.com//watch?v=yXh1p2oBbPI,8,A life-saving device that detects silent heart attacks | Akash Manoj,63320,2000,124,6,2,2019,6/2/2019,Wed
https://www.youtube.com//watch?v=g7F9XCdeOtw,13,Why Black girls are targeted for punishment at school -- and how to change that | Monique W. Morris,90200,2600,306,6,2,2019,6/2/2019,Wed
https://www.youtube.com//watch?v=kBBmVezBUkg,13,A mother and son's photographic journey through dementia | Tony Luciani,98207,3700,191,5,2,2019,5/2/2019,Tue
https://www.youtube.com//watch?v=aRcD31sA2a0,11,3 ways to build a happy marriage and avoid divorce | George Blair-West,516969,10000,914,4,2,2019,4/2/2019,Mon
https://www.youtube.com//watch?v=QuR969uMICM,10,A beginner's guide to quantum computing | Shohini Ghose,1963384,44000,2678,1,2,2019,1/2/2019,Fri
https://www.youtube.com//watch?v=b-HkNXW4nmU,10,How India's smartphone revolution is creating a new generation of readers and writers | Chiki Sarkar,64278,1300,156,1,2,2019,1/2/2019,Fri
https://www.youtube.com//watch?v=o_U-_akINwQ,12,What should electric cars sound like? | Renzo Vitale,69199,1200,304,31,1,2019,31/1/2019,Thu
https://www.youtube.com//watch?v=_vCIktrORFU,11,How I unlearned dangerous lessons about masculinity | Eldra Jackson,90219,3400,850,30,1,2019,30/1/2019,Wed
https://www.youtube.com//watch?v=OWiiA9hXbY8,13,What are you willing to give up to change the way we work? | Martin Danoesastro,126076,2000,98,29,1,2019,29/1/2019,Tue
https://www.youtube.com//watch?v=9NZCWeBNPeE,13,The story of a parent's transition and a son's redemption | Paula Stone and Jonathan Williams,70693,2300,165,28,1,2019,28/1/2019,Mon
https://www.youtube.com//watch?v=ygHwQXIlKJI,12,"Stunning buildings made from raw, imperfect materials | Débora Mesa Molina",112751,3200,155,25,1,2019,25/1/2019,Fri
https://www.youtube.com//watch?v=7G4WI4oTC5A,14,What sticky sea creatures can teach us about making glue | Jonathan Wilker,50912,1100,68,25,1,2019,25/1/2019,Fri
https://www.youtube.com//watch?v=o_XVt5rdpFY,11,The secrets of learning a new language | Lýdia Machová,7095129,265000,7696,24,1,2019,24/1/2019,Thu
https://www.youtube.com//watch?v=iu9u5yzUlb0,12,How to break bad management habits before they reach the next generation of leaders | Elizabeth Lyle,148216,2200,116,23,1,2019,23/1/2019,Wed
https://www.youtube.com//watch?v=bLAw7yF0YBc,14,"In the opioid crisis, here's what it takes to save a life | Jan Rader",94318,2100,252,23,1,2019,23/1/2019,Wed
