video_link,duration,title,views,likes,comments,date,month,year,date_month_year,day
https://www.youtube.com//watch?v=lAzQWtkPzbI,13,How we're harnessing nature's hidden superpowers | Oded Shoseyov,132846,3400,159,18,10,2016,18/10/2016,Tue
https://www.youtube.com//watch?v=iEy-xTbcr2A,15,America's forgotten working class | J.D. Vance,295477,6300,657,17,10,2016,17/10/2016,Mon
https://www.youtube.com//watch?v=8v_GrrQs8ow,12,We can fight terror without sacrificing our rights | Rebecca MacKinnon,62281,1100,172,14,10,2016,14/10/2016,Fri
https://www.youtube.com//watch?v=DzNN_4rcIjs,13,The era of personal DNA testing is here | Sebastian Kraves,92092,1500,128,13,10,2016,13/10/2016,Thu
https://www.youtube.com//watch?v=3bj-ba3P_cU,7,Why open a school? To close a prison | Nadia Lopez,96035,2700,174,12,10,2016,12/10/2016,Wed
https://www.youtube.com//watch?v=TvcNw4F0Y4Y,7,Why you should know how much your coworkers get paid | David Burkus,183999,2600,375,11,10,2016,11/10/2016,Tue
https://www.youtube.com//watch?v=NqOjj1FCcVY,13,There's no such thing as not voting | Eric Liu,97464,1600,453,10,10,2016,10/10/2016,Mon
https://www.youtube.com//watch?v=uq-6T6TAu74,12,Why some people are more altruistic than others | Abigail Marsh,311125,6000,620,7,10,2016,7/10/2016,Fri
https://www.youtube.com//watch?v=MvXZzKZ3JYQ,15,Architecture that's built to heal | Michael Murphy,230810,7700,179,6,10,2016,6/10/2016,Thu
https://www.youtube.com//watch?v=LZXUR4z2P9w,14,How fear of nuclear power is hurting the environment | Michael Shellenberger,531284,21000,4205,5,10,2016,5/10/2016,Wed
https://www.youtube.com//watch?v=CyElHdaqkjo,14,How to raise successful kids -- without over-parenting | Julie Lythcott-Haims,2595135,67000,1705,4,10,2016,4/10/2016,Tue
https://www.youtube.com//watch?v=pPgd7Hj3ABQ,16,The future of money | Neha Narula,373993,5500,693,3,10,2016,3/10/2016,Mon
https://www.youtube.com//watch?v=IYDqtxvKDW4,9,A new way to heal hearts without surgery | Franz Freudenthal,107271,2300,124,30,9,2016,30/9/2016,Fri
https://www.youtube.com//watch?v=druJDI6hiiY,16,Why helmets don't prevent concussions -- and what might | David Camarillo,262085,3900,335,29,9,2016,29/9/2016,Thu
https://www.youtube.com//watch?v=jPf0LjZAS14,15,The new American Dream | Courtney Martin,204461,2800,288,28,9,2016,28/9/2016,Wed
https://www.youtube.com//watch?v=-MTRxRO5SRA,11,Let's teach for mastery -- not test scores | Sal Khan,1989779,73000,3448,26,9,2016,26/9/2016,Mon
https://www.youtube.com//watch?v=T_cetimMBL8,18,The risky politics of progress | Jonathan Tepperman,61828,1200,207,24,9,2016,24/9/2016,Sat
https://www.youtube.com//watch?v=rFpDK2KhAgw,12,Why you should talk to strangers | Kio Stark,593917,9400,630,24,9,2016,24/9/2016,Sat
https://www.youtube.com//watch?v=rAZPIxYvBAE,16,Bring on the female superheroes! | Christopher Bell,119861,5200,748,22,9,2016,22/9/2016,Thu
https://www.youtube.com//watch?v=e-BZigXlphY,12,How women wage conflict without violence | Julia Bacha,68569,1100,411,21,9,2016,21/9/2016,Wed
https://www.youtube.com//watch?v=M_X0uwAG2Jc,11,The spellbinding art of human anatomy | Vanessa Ruiz,116318,2500,72,19,9,2016,19/9/2016,Mon
https://www.youtube.com//watch?v=Pl8OlkkwRpc,19,How the blockchain is changing money and business | Don Tapscott,4398049,75000,22923,16,9,2016,16/9/2016,Fri
https://www.youtube.com//watch?v=IL2lb9fmIV8,11,The deadly legacy of cluster bombs | Laura Boushnak,88678,1000,162,15,9,2016,15/9/2016,Thu
https://www.youtube.com//watch?v=5qaktKVL_zM,13,What we can do to die well | Timothy Ihrig,84241,1400,105,14,9,2016,14/9/2016,Wed
https://www.youtube.com//watch?v=AyWtIwwEgS0,12,The next manufacturing revolution is here | Olivier Scalabre,461338,5400,626,14,9,2016,14/9/2016,Wed
https://www.youtube.com//watch?v=k5tCYg9s0HU,17,A letter to all who have lost in this era | Anand Giridharadas,96017,2200,270,12,9,2016,12/9/2016,Mon
https://www.youtube.com//watch?v=50yxXTAHrfc,14,Gonzalo Vilariño: How Argentina's blind soccer team became champions (with English subtitles) | TED,61520,691,88,9,9,2016,9/9/2016,Fri
https://www.youtube.com//watch?v=Dh5sPiuaO9Y,7,Hunting for Peru's lost civilizations -- with satellites | Sarah Parcak,114075,1300,149,8,9,2016,8/9/2016,Thu
https://www.youtube.com//watch?v=P1sbSJK1LiI,10,3 moons and a planet that could have alien life | James Green,352059,4300,522,7,9,2016,7/9/2016,Wed
https://www.youtube.com//watch?v=JI-HzvXk5bk,16,A small country with big ideas to get rid of fossil fuels | Monica Araya,171943,3800,418,6,9,2016,6/9/2016,Tue
https://www.youtube.com//watch?v=9RTkZaX1cH0,14,What a planet needs to sustain life | Dave Brain,381700,7400,373,4,9,2016,4/9/2016,Sun
https://www.youtube.com//watch?v=CPVjktgYKo4,15,How Africa can keep rising | Ngozi Okonjo-Iweala,86762,2000,327,3,9,2016,3/9/2016,Sat
https://www.youtube.com//watch?v=2Brajdazp1o,12,The taboo secret to better health | Molly Winter,320095,4000,349,3,9,2016,3/9/2016,Sat
https://www.youtube.com//watch?v=l1fodZNF1GI,15,How to build a business that lasts 100 years | Martin Reeves,248556,3500,109,1,9,2016,1/9/2016,Thu
https://www.youtube.com//watch?v=gWmRkYsLzB4,4,The jobs we'll lose to machines -- and the ones we won't | Anthony Goldbloom,474247,7000,692,31,8,2016,31/8/2016,Wed
https://www.youtube.com//watch?v=Un2yBgIAxYs,18,How trees talk to each other | Suzanne Simard,1944534,44000,2151,30,8,2016,30/8/2016,Tue
https://www.youtube.com//watch?v=CDdpQSLr7YE,13,A new way to study the brain's invisible secrets | Ed Boyden,141136,2800,134,29,8,2016,29/8/2016,Mon
https://www.youtube.com//watch?v=qNvDRuGK84I,13,How the Panama Papers journalists broke the biggest leak in history | Gerard Ryle,107220,2400,192,26,8,2016,26/8/2016,Fri
https://www.youtube.com//watch?v=g9M3HIjHuq0,11,"A project of peace, painted across 50 buildings | eL Seed",116146,2700,95,25,8,2016,25/8/2016,Thu
https://www.youtube.com//watch?v=c8WMM_PUOj0,12,A forgotten Space Age technology could change how we grow food | Lisa Dyson,97049,2200,185,25,8,2016,25/8/2016,Thu
https://www.youtube.com//watch?v=cXbXNV9-ZAg,13,My love letter to cosplay | Adam Savage,1823389,103000,2158,23,8,2016,23/8/2016,Tue
https://www.youtube.com//watch?v=mjUsobGWhs8,9,How to grow a forest in your backyard | Shubhendu Sharma,2123366,67000,2182,22,8,2016,22/8/2016,Mon
https://www.youtube.com//watch?v=hiIcwt88o94,16,Nature is everywhere -- we just need to learn to see it | Emma Marris,121204,2600,170,20,8,2016,20/8/2016,Sat
https://www.youtube.com//watch?v=b28brIs1OmM,14,3 lessons on success from an Arab businesswoman | Leila Hoteit,279620,5400,415,17,8,2016,17/8/2016,Wed
https://www.youtube.com//watch?v=g2m97gPI70I,13,"When we design for disability, we all benefit | Elise Roy",107824,1800,138,16,8,2016,16/8/2016,Tue
https://www.youtube.com//watch?v=B4a0NvLTebw,11,"Why I keep speaking up, even when people mock my accent | Safwat Saleem",193502,4700,356,15,8,2016,15/8/2016,Mon
https://www.youtube.com//watch?v=dcwuBo4PvE0,17,Why Brexit happened -- and what to do next | Alexander Betts,1815658,25000,8565,12,8,2016,12/8/2016,Fri
https://www.youtube.com//watch?v=8yqAD0MX3Zk,10,How Syria's architecture laid the foundation for brutal war | Marwa Al-Sabouni,122618,1700,326,11,8,2016,11/8/2016,Thu
https://www.youtube.com//watch?v=Znc6TJAAXFU,8,"""Redemption Song"" | John Legend",304283,4000,159,10,8,2016,10/8/2016,Wed
https://www.youtube.com//watch?v=Sd7lvPpDDUg,5,"Clues to prehistoric times, found in blind cavefish | Prosanta Chakrabarty",73260,1700,89,9,8,2016,9/8/2016,Tue
https://www.youtube.com//watch?v=w4RLfVxTGH4,11,Why you think you're right -- even if you're wrong | Julia Galef,1893494,48000,2354,8,8,2016,8/8/2016,Mon
https://www.youtube.com//watch?v=uSUOdu_5MPc,17,How computers are learning to be creative | Blaise Agüera y Arcas,422273,9100,464,22,7,2016,22/7/2016,Fri
https://www.youtube.com//watch?v=P9B8PmUR64U,7,What can we learn from shortcuts? | Tom Hulme,152464,3500,115,21,7,2016,21/7/2016,Thu
https://www.youtube.com//watch?v=7sqeoYOQ4qg,14,How to fix a broken education system ... without any more money | Seema Bansal,245537,5400,389,20,7,2016,20/7/2016,Wed
https://www.youtube.com//watch?v=qYvXk_bqlBk,15,"Who are you, really? The puzzle of personality | Brian Little",9488306,234000,3934,19,7,2016,19/7/2016,Tue
https://www.youtube.com//watch?v=C44r6knuJtU,7,Why genetic research must be more diverse | Keolu Fox,71710,1400,143,15,7,2016,15/7/2016,Fri
https://www.youtube.com//watch?v=D55ctBYF3AY,15,How better tech could protect us from distraction | Tristan Harris,263309,6800,304,14,7,2016,14/7/2016,Thu
https://www.youtube.com//watch?v=-hY9QSdaReY,11,How a blind astronomer found a way to hear the stars | Wanda Diaz Merced,68193,1500,87,13,7,2016,13/7/2016,Wed
https://www.youtube.com//watch?v=cJg_tPB0Nu0,17,The birth of virtual reality as an art form | Chris Milk,115883,3000,195,11,7,2016,11/7/2016,Mon
https://www.youtube.com//watch?v=7LPJrzZaoZg,7,This scientist makes ears out of apples | Andrew Pelling,126202,2600,130,8,7,2016,8/7/2016,Fri
https://www.youtube.com//watch?v=OIpgrZ8yS-Q,9,The secret to effective nonviolent resistance | Jamila Raqib,142301,4300,251,7,7,2016,7/7/2016,Thu
https://www.youtube.com//watch?v=wlR1ojoiue0,13,3 reasons why we can win the fight against poverty | Andrew Youn,153781,3700,487,6,7,2016,6/7/2016,Wed
https://www.youtube.com//watch?v=XiDAztWWAuM,8,A highly scientific taxonomy of haters | Negin Farsad,156687,3200,1338,5,7,2016,5/7/2016,Tue
https://www.youtube.com//watch?v=YXWKuK-Qsu4,12,How college loans exploit students for profit | Sajay Samuel,221534,6500,847,2,7,2016,2/7/2016,Sat
https://www.youtube.com//watch?v=Kxg0_EpOcWs,6,"The Chinese zodiac, explained | ShaoLan",1215488,21000,2080,30,6,2016,30/6/2016,Thu
https://www.youtube.com//watch?v=CjB6DQGalU0,15,Every piece of art you've ever wanted to see -- up close and searchable | Amit Sood,97548,2200,106,29,6,2016,29/6/2016,Wed
https://www.youtube.com//watch?v=Kc0Kthyo0hU,16,What's so sexy about math? | Cédric Villani,615287,14000,1001,29,6,2016,29/6/2016,Wed
https://www.youtube.com//watch?v=afev0ZjAhUA,12,"The passing of time, caught in a single photo | Stephen Wilkes",194554,5100,313,28,6,2016,28/6/2016,Tue
https://www.youtube.com//watch?v=ktD119xbBtY,4,Ideas worth dating,131970,3100,150,27,6,2016,27/6/2016,Mon
https://www.youtube.com//watch?v=3dy4SGkSD8M,20,An entertainment icon on living a life of meaning | Norman Lear,87279,1100,100,25,6,2016,25/6/2016,Sat
https://www.youtube.com//watch?v=6LmPq7D-ds0,13,The real harm of the global arms trade | Samantha Nutt,79458,1600,284,23,6,2016,23/6/2016,Thu
https://www.youtube.com//watch?v=ddxHlkIuHqg,14,"A smarter, more precise way to think about public health | Sue Desmond-Hellmann",100990,1300,114,22,6,2016,22/6/2016,Wed
https://www.youtube.com//watch?v=nCwwVjPNloY,18,My journey from Marine to actor | Adam Driver,10461298,311000,9431,21,6,2016,21/6/2016,Tue
https://www.youtube.com//watch?v=ppZ2WIlRvR8,13,Joseph Ravenell: How barbershops can keep men healthy | TED,82083,1300,189,20,6,2016,20/6/2016,Mon
https://www.youtube.com//watch?v=9VF7kffCgJU,7,Drawings that show the beauty and fragility of Earth | Zaria Forman,254492,5600,228,18,6,2016,18/6/2016,Sat
https://www.youtube.com//watch?v=uTL9tm7S1Io,12,Your words may predict your future mental health | Mariano Sigman,776451,11000,505,17,6,2016,17/6/2016,Fri
https://www.youtube.com//watch?v=9AgCr2tTvng,13,The beauty of being a misfit | Lidia Yuknavitch,488557,13000,584,15,6,2016,15/6/2016,Wed
https://www.youtube.com//watch?v=A-OvJjAw2Jo,5,How free is our freedom of the press? | Trevor Timm,104194,2400,125,14,6,2016,14/6/2016,Tue
https://www.youtube.com//watch?v=o9DNWK6WfQw,13,Our lonely society makes it hard to come home from war | Sebastian Junger,528077,15000,1064,11,6,2016,11/6/2016,Sat
https://www.youtube.com//watch?v=tRqJysI-yiw,6,Good news in the fight against pancreatic cancer | Laura Indolfi,126556,2200,303,9,6,2016,9/6/2016,Thu
https://www.youtube.com//watch?v=6diqpGKOvic,13,Can you really tell if a kid is lying? | Kang Lee,10417185,252000,18864,8,6,2016,8/6/2016,Wed
https://www.youtube.com//watch?v=_bphPa7Wp4c,11,This tiny particle could roam your body to find tumors | Sangeeta Bhatia,107339,2300,171,7,6,2016,7/6/2016,Tue
https://www.youtube.com//watch?v=MO0L_LY2hRA,4,An artist's unflinching look at racial violence | Sanford Biggers,64083,1800,376,6,6,2016,6/6/2016,Mon
https://www.youtube.com//watch?v=FDhlOovaGrI,15,This is your brain on communication | Uri Hasson,229677,3200,169,3,6,2016,3/6/2016,Fri
https://www.youtube.com//watch?v=OI_OhvOumT0,12,Gene editing can now change an entire species -- forever | Jennifer Kahn,459992,9700,1640,2,6,2016,2/6/2016,Thu
https://www.youtube.com//watch?v=iF5-aDJOr6U,11,This virtual lab will revolutionize science class | Michael Bodekaer,182806,3700,225,1,6,2016,1/6/2016,Wed
https://www.youtube.com//watch?v=8HfoKd873HY,12,A sci-fi vision of love from a 318-year-old hologram | Monica Byrne,110928,1700,352,31,5,2016,31/5/2016,Tue
https://www.youtube.com//watch?v=hxsnKwmW0dk,12,The dream we haven't dared to dream | Dan Pallotta,135563,2900,221,27,5,2016,27/5/2016,Fri
https://www.youtube.com//watch?v=vC1uxXvPG0Q,12,"Pirates, nurses and other rebel designers | Alice Rawsthorn",125110,1200,69,26,5,2016,26/5/2016,Thu
https://www.youtube.com//watch?v=mxNpNuogqsY,10,How my son's short life made a lasting difference | Sarah Gray,85275,2100,116,25,5,2016,25/5/2016,Wed
https://www.youtube.com//watch?v=s6rJLXq1Re0,15,How to read the genome and build a human being | Riccardo Sabatini,269273,7200,335,24,5,2016,24/5/2016,Tue
https://www.youtube.com//watch?v=UoMpbL_Fsig,13,A provocative way to finance the fight against climate change | Michael Metcalfe,62247,969,318,23,5,2016,23/5/2016,Mon
https://www.youtube.com//watch?v=xgYtUKFzHf8,8,Why I put myself in danger to tell the stories of Gaza | Ameera Harouda,84250,2400,877,20,5,2016,20/5/2016,Fri
https://www.youtube.com//watch?v=9kBKQS7J7xI,13,Insightful human portraits made from data | R. Luke DuBois,114627,3700,124,19,5,2016,19/5/2016,Thu
https://www.youtube.com//watch?v=kSR8G8mfp84,8,A smart new business loan for people with no credit | Shivani Siroya,161842,2300,236,18,5,2016,18/5/2016,Wed
https://www.youtube.com//watch?v=o1Z4F4e2Bw4,16,Hunting for dinosaurs showed me our place in the universe | Kenneth Lacovara,704475,17000,2086,17,5,2016,17/5/2016,Tue
https://www.youtube.com//watch?v=OaGEM-Rms48,11,A taboo-free way to talk about periods | Aditi Gupta,310679,5100,331,16,5,2016,16/5/2016,Mon
https://www.youtube.com//watch?v=bEdvQjTGYP8,15,We can reprogram life. How to do it wisely | Juan Enriquez,143322,3500,234,13,5,2016,13/5/2016,Fri
https://www.youtube.com//watch?v=fhCY_8avhWM,6,Wisdom from great writers on every year of life | Joshua Prager,188805,2100,106,12,5,2016,12/5/2016,Thu
https://www.youtube.com//watch?v=MIA_1xQc7x8,15,The inside story of the Paris climate agreement | Christiana Figueres,239299,3300,579,11,5,2016,11/5/2016,Wed
https://www.youtube.com//watch?v=rToBZSrxjgM,10,The nit-picking glory of The New Yorker's Comma Queen | Mary Norris,72582,1200,126,10,5,2016,10/5/2016,Tue
https://www.youtube.com//watch?v=2t13Rq4oc7A,15,The unexpected benefit of celebrating failure | Astro Teller,318132,5100,213,9,5,2016,9/5/2016,Mon
https://www.youtube.com//watch?v=1N39Z0ODeME,11,A new superweapon in the fight against cancer | Paula Hammond,141352,2400,293,6,5,2016,6/5/2016,Fri
https://www.youtube.com//watch?v=t9c7aheZxls,17,Your kids might live on Mars. Here's how they'll survive | Stephen Petranek,5554227,96000,18215,5,5,2016,5/5/2016,Thu
https://www.youtube.com//watch?v=ODLg_00f9BE,17,What does it mean to be a citizen of the world? | Hugh Evans,378351,7200,723,4,5,2016,4/5/2016,Wed
https://www.youtube.com//watch?v=o8NPllzkFhE,21,The mind behind Linux | Linus Torvalds,4691007,112000,4778,3,5,2016,3/5/2016,Tue
https://www.youtube.com//watch?v=10MvdLL2EpY,8,The Panama Papers exposed a huge global problem. What's next? | Robert Palmer,133962,2600,434,2,5,2016,2/5/2016,Mon
https://www.youtube.com//watch?v=gypAjPp6eps,14,The most mysterious star in the universe | Tabetha Boyajian,5704154,68000,10910,29,4,2016,29/4/2016,Fri
https://www.youtube.com//watch?v=Z1R1z9ipFnM,12,The magic ingredient that brings Pixar movies to life | Danielle Feinberg,716031,17000,447,28,4,2016,28/4/2016,Thu
https://www.youtube.com//watch?v=U7y4GlmwPLQ,20,How megacities are changing the map of the world | Parag Khanna,237556,4900,511,27,4,2016,27/4/2016,Wed
https://www.youtube.com//watch?v=fxbCHn6gE3U,15,The surprising habits of original thinkers | Adam Grant,9176921,228000,5791,26,4,2016,26/4/2016,Tue
https://www.youtube.com//watch?v=3OgsRa7VDtI,15,How a start-up in the White House is changing business as usual | Haley Van Dyck,83841,952,155,25,4,2016,25/4/2016,Mon
https://www.youtube.com//watch?v=XVXmYD0UPRQ,10,Two reasons companies fail -- and how to avoid them | Knut Haanaes,228742,2800,116,22,4,2016,22/4/2016,Fri
https://www.youtube.com//watch?v=CtvIX4s1bTU,13,How humans could evolve to survive in space | Lisa Nip,185131,4400,547,21,4,2016,21/4/2016,Thu
https://www.youtube.com//watch?v=G8gJJuCdP_A,13,Why gun violence can't be our new normal | Dan Gross,97230,2200,1295,20,4,2016,20/4/2016,Wed
https://www.youtube.com//watch?v=-FOCpMAww28,8,TED's secret to great public speaking | Chris Anderson,2374525,43000,626,19,4,2016,19/4/2016,Tue
https://www.youtube.com//watch?v=NiMgOklgeos,11,The beauty of human skin in every color | Angélica Dass,346046,9300,523,19,4,2016,19/4/2016,Tue
https://www.youtube.com//watch?v=1cQbMP3I5Sk,19,The dawn of the age of holograms | Alex Kipman,2045198,23000,2519,18,4,2016,18/4/2016,Mon
https://www.youtube.com//watch?v=jggHw5PdQV0,14,How young Africans found a voice on Twitter | Siyanda Mohutsiwa,71530,1900,174,15,4,2016,15/4/2016,Fri
https://www.youtube.com//watch?v=c9V6OKlY80k,12,You have no idea where camels really come from | Latif Nasser,763734,14000,1716,14,4,2016,14/4/2016,Thu
https://www.youtube.com//watch?v=_wMTKRixZIE,12,How to get back to work after a career break | Carol Fishman Cohen,183269,2800,187,13,4,2016,13/4/2016,Wed
https://www.youtube.com//watch?v=H9ZOpQzjukY,11,A glimpse of the future through an augmented reality headset | Meron Gribetz,370805,5300,516,11,4,2016,11/4/2016,Mon
https://www.youtube.com//watch?v=87AEeLpodnE,14,A conservative's plea: Let's work together | Arthur Brooks,145445,2600,772,8,4,2016,8/4/2016,Fri
https://www.youtube.com//watch?v=orumugzJpt0,6,The reporting system that sexual assault survivors want | Jessica Ladd,111651,2200,1212,7,4,2016,7/4/2016,Thu
https://www.youtube.com//watch?v=arj7oStGLkU,14,Tim Urban: Inside the mind of a master procrastinator | TED,47561789,1600000,76779,6,4,2016,6/4/2016,Wed
https://www.youtube.com//watch?v=16cM-RFid9U,16,How Airbnb designs for trust | Joe Gebbia,445859,8400,343,5,4,2016,5/4/2016,Tue
https://www.youtube.com//watch?v=DsrxbqFo41k,18,The gospel of doubt | Casey Gerald,136242,3800,319,4,4,2016,4/4/2016,Mon
https://www.youtube.com//watch?v=7Lc_dlVrg5M,19,This country isn't just carbon neutral — it's carbon negative | Tshering Tobgay,3208018,126000,8210,1,4,2016,1/4/2016,Fri
https://www.youtube.com//watch?v=Gg5M3J_FHXY,7,Simple hacks for life with Parkinson's | Mileha Soneji,140536,3300,118,31,3,2016,31/3/2016,Thu
https://www.youtube.com//watch?v=6MgDcFlTgVM,11,The secrets I find on the mysterious ocean floor | Laura Robinson,125284,1500,104,30,3,2016,30/3/2016,Wed
https://www.youtube.com//watch?v=fC9da6eqaqg,12,"Teach girls bravery, not perfection | Reshma Saujani",1133992,26000,1553,28,3,2016,28/3/2016,Mon
https://www.youtube.com//watch?v=pb--rJGgVIo,19,Uber's plan to get more people into fewer cars | Travis Kalanick,240245,3300,439,25,3,2016,25/3/2016,Fri
https://www.youtube.com//watch?v=kLIfeGflNp8,18,Our refugee system is failing. Here's how we can fix it | Alexander Betts,136770,3100,903,24,3,2016,24/3/2016,Thu
https://www.youtube.com//watch?v=avuhY7D71sQ,15,What really happens when you mix medications? | Russ Altman,179911,4200,254,23,3,2016,23/3/2016,Wed
https://www.youtube.com//watch?v=NFDmsNCGcvc,5,How yarn bombing grew into a worldwide movement | Magda Sayeg,150424,1700,163,22,3,2016,22/3/2016,Tue
https://www.youtube.com//watch?v=9bbX13SfsBw,10,Dive into an ocean photographer's world | Thomas Peschak,138481,4300,137,21,3,2016,21/3/2016,Mon
https://www.youtube.com//watch?v=XAcARiiK5uY,12,Why we need gender-neutral bathrooms | Ivan Coyote,189991,4800,2786,18,3,2016,18/3/2016,Fri
https://www.youtube.com//watch?v=E_NiCniw0JE,14,Why your doctor should care about social justice | Mary Bassett,65978,787,557,17,3,2016,17/3/2016,Thu
https://www.youtube.com//watch?v=y7l5QHRY_AI,12,How to make a profit while making a difference | Audrey Choi,97710,1300,88,16,3,2016,16/3/2016,Wed
https://www.youtube.com//watch?v=wzkFoetp-_M,16,What it's like to be a Muslim in America | Dalia Mogahed,4810905,183000,15182,16,3,2016,16/3/2016,Wed
https://www.youtube.com//watch?v=gVfgkFaswn4,25,The case for optimism on climate change | Al Gore,345066,7400,1295,14,3,2016,14/3/2016,Mon
https://www.youtube.com//watch?v=RCXGpEmFbOw,11,Meet the dazzling flying machines of the future | Raffaello D'Andrea,8429203,131000,5588,12,3,2016,12/3/2016,Sat
https://www.youtube.com//watch?v=jMVAgCPYYHY,11,What the discovery of gravitational waves means | Allan Adams,740912,10000,1132,10,3,2016,10/3/2016,Thu
https://www.youtube.com//watch?v=gmj-azFbpkA,19,My year of saying yes to everything | Shonda Rhimes,1547189,41000,1589,9,3,2016,9/3/2016,Wed
https://www.youtube.com//watch?v=R1vskiVDwl4,12,Celeste Headlee: 10 ways to have a better conversation | TED,12323256,319000,4834,8,3,2016,8/3/2016,Tue
https://www.youtube.com//watch?v=6d6oq0zGGmw,11,The brain may be able to repair itself -- with help | Jocelyne Bloch,790940,17000,1118,7,3,2016,7/3/2016,Mon
https://www.youtube.com//watch?v=KxLMjn4WPBY,14,The problem with race-based medicine | Dorothy Roberts,137058,2500,938,5,3,2016,5/3/2016,Sat
https://www.youtube.com//watch?v=a7cDt5r2pGY,15,The case for fish farming | Mike Velings,110212,2200,397,3,3,2016,3/3/2016,Thu
https://www.youtube.com//watch?v=WHjKnNbYiOs,12,How I'm discovering the secrets of ancient texts | Gregory Heyworth,93109,2300,153,2,3,2016,2/3/2016,Wed
https://www.youtube.com//watch?v=8sheoGMsy3Q,9,Shape-shifting tech will change work as we know it | Sean Follmer,233258,5100,375,1,3,2016,1/3/2016,Tue
https://www.youtube.com//watch?v=V1ItvwxBENg,14,Economic growth has stalled. Let's fix it | Dambisa Moyo,84232,901,530,29,2,2016,29/2/2016,Mon
https://www.youtube.com//watch?v=zqLYcJ6Ib3c,14,Special Olympics let me be myself — a champion | Matthew Williams,72092,1300,164,27,2,2016,27/2/2016,Sat
https://www.youtube.com//watch?v=G8RxjxdUulE,9,How we'll fight the next deadly virus | Pardis Sabeti,76882,1200,77,25,2,2016,25/2/2016,Thu
https://www.youtube.com//watch?v=-moW9jvvMr4,9,A simple way to break a bad habit | Judson Brewer,10879271,207000,4482,24,2,2016,24/2/2016,Wed
https://www.youtube.com//watch?v=k4N2SxUZwiU,16,How I found a mythical boiling river in the Amazon | Andrés Ruzo,463962,11000,558,24,2,2016,24/2/2016,Wed
https://www.youtube.com//watch?v=vcxwcWuq7KQ,11,A delightful way to teach kids about computers | Linda Liukas,228765,4400,229,24,2,2016,24/2/2016,Wed
https://www.youtube.com//watch?v=P8GCjrDWWUM,11,Our campaign to ban plastic bags in Bali | Melati and Isabel Wijsen,305139,4800,436,19,2,2016,19/2/2016,Fri
https://www.youtube.com//watch?v=K926HAKRFvw,14,A robot that runs and swims like a salamander | Auke Ijspeert,806174,10000,487,18,2,2016,18/2/2016,Thu
https://www.youtube.com//watch?v=r_xV-M0KPo0,18,Should you be able to patent a human gene? | Tania Simoncelli,70230,2000,182,18,2,2016,18/2/2016,Thu
https://www.youtube.com//watch?v=96HHmILhyrE,14,Glow-in-the-dark sharks and other stunning sea creatures | David Gruber,480739,9600,450,17,2,2016,17/2/2016,Wed
https://www.youtube.com//watch?v=GB4s5b9NL3I,20,Capitalism will eat democracy -- unless we speak up | Yanis Varoufakis,1143159,30000,4677,15,2,2016,15/2/2016,Mon
https://www.youtube.com//watch?v=iqEHuB-T2qQ,7,Achenyo Idachaba: How I turned a deadly plant into a thriving business | TED,73497,2100,108,11,2,2016,11/2/2016,Thu
https://www.youtube.com//watch?v=UpkAqPEcMyE,11,Can a computer write poetry? | Oscar Schwartz,84038,1700,272,10,2,2016,10/2/2016,Wed
https://www.youtube.com//watch?v=2NWpMqD8Qyk,14,How we can make crops survive without water | Jill Farrant,187953,3900,596,9,2,2016,9/2/2016,Tue
https://www.youtube.com//watch?v=O3a9AYu5SUQ,7,The mysterious world of underwater caves | Jill Heinerth,464732,6900,332,8,2,2016,8/2/2016,Mon
https://www.youtube.com//watch?v=iQsnObyii4Q,16,Why great architecture should tell a story | Ole Scheeren,761965,16000,386,5,2,2016,5/2/2016,Fri
https://www.youtube.com//watch?v=HiwJ0hNl1Fw,13,Let's design social media that drives real change | Wael Ghonim,407135,7700,639,4,2,2016,4/2/2016,Thu
https://www.youtube.com//watch?v=IfjI0tVUpbc,13,"I love being a police officer, but we need reform | Melvin Russell",137470,3400,378,3,2,2016,3/2/2016,Wed
https://www.youtube.com//watch?v=N7wF2AdVy2Q,15,How frustration can make us more creative | Tim Harford,288376,6000,133,2,2,2016,2/2/2016,Tue
https://www.youtube.com//watch?v=sLFqwXqe4Yk,13,4 ways we can avoid a catastrophic drought | David Sedlak,83583,1000,116,29,1,2016,29/1/2016,Fri
https://www.youtube.com//watch?v=yBdyFKqwKy0,5,Aomawa Shields: How we'll find life on other planets | TED,107608,2600,377,28,1,2016,28/1/2016,Thu
https://www.youtube.com//watch?v=vQILP19qABk,12,How to use data to make a hit TV show | Sebastian Wernicke,117850,2000,84,27,1,2016,27/1/2016,Wed
https://www.youtube.com//watch?v=gWPFJgLAzu4,14,Have we reached the end of physics? | Harry Cliff,639258,10000,1154,26,1,2016,26/1/2016,Tue
