video_link,duration,title,views,likes,comments,date,month,year,date_month_year,day
https://www.youtube.com//watch?v=LI8ix9IghkY,10,"Karen Bass: Unseen footage, untamed nature",89661,1300,123,9,5,2012,9/5/2012,Wed
https://www.youtube.com//watch?v=3A1LvXRnpVg,8,JP Rangaswami: Information is food,65253,1000,97,8,5,2012,8/5/2012,Tue
https://www.youtube.com//watch?v=FD5ZKi-moMU,20,Michael Tilson Thomas: Music and emotion through time,604785,9500,513,7,5,2012,7/5/2012,Mon
https://www.youtube.com//watch?v=iueVZJVEmEs,18,Rory Sutherland: Perspective is everything,959118,16000,467,4,5,2012,4/5/2012,Fri
https://www.youtube.com//watch?v=f_f5wNw-2c0,6,Gary Kovacs: Tracking the trackers,165519,2200,235,3,5,2012,3/5/2012,Thu
https://www.youtube.com//watch?v=_L052IOoX0Y,9,Reuben Margolin: Sculpting waves in wood and time,43346,888,88,2,5,2012,2/5/2012,Wed
https://www.youtube.com//watch?v=ZHOyfyGwpes,27,Amory Lovins: A 40-year plan for energy,136061,2200,311,2,5,2012,2/5/2012,Wed
https://www.youtube.com//watch?v=8OnsjVdEuRk,12,Liz Diller: A giant bubble for debate,39582,347,190,1,5,2012,1/5/2012,Tue
https://www.youtube.com//watch?v=B8Z2G7d2kzs,12,Eduardo Paes: The 4 commandments of cities,63657,693,167,27,4,2012,27/4/2012,Fri
https://www.youtube.com//watch?v=4q1dgn_C0AU,21,The surprising science of happiness | Dan Gilbert,3837419,35000,1395,27,4,2012,27/4/2012,Fri
https://www.youtube.com//watch?v=onLPDegxXx8,16,Our buggy moral code | Dan Ariely,241811,3300,155,27,4,2012,27/4/2012,Fri
https://www.youtube.com//watch?v=PsihkFWDt3Y,11,How to buy happiness | Michael Norton,644533,5700,406,24,4,2012,24/4/2012,Tue
https://www.youtube.com//watch?v=bf7BXwVeyWw,22,Why is our universe fine-tuned for life? | Brian Greene,4414753,60000,12415,24,4,2012,24/4/2012,Tue
https://www.youtube.com//watch?v=4ZB29iq_Zd8,5,Christina Warinner: Tracking ancient diseases using ... plaque,41949,551,43,20,4,2012,20/4/2012,Fri
https://www.youtube.com//watch?v=7gkdzkVbuVA,11,Laura Carstensen: Older people are happier,96273,758,205,20,4,2012,20/4/2012,Fri
https://www.youtube.com//watch?v=vvhiN_qq6oo,18,Taryn Simon: The stories behind the bloodlines,48049,540,123,18,4,2012,18/4/2012,Wed
https://www.youtube.com//watch?v=E_lb3D7Ay-M,7,Drew Curtis: How I beat a patent troll,142365,3000,299,17,4,2012,17/4/2012,Tue
https://www.youtube.com//watch?v=L3QkaS249Bc,19,How do we heal medicine? | Atul Gawande,390410,4300,188,16,4,2012,16/4/2012,Mon
https://www.youtube.com//watch?v=RDIy58g9n2k,6,Abigail Washburn: Building US-China relations ... by banjo,112000,1400,139,14,4,2012,14/4/2012,Sat
https://www.youtube.com//watch?v=9-qHrhrTktc,13,Tal Golesworthy: How I repaired my own heart,92622,1500,150,12,4,2012,12/4/2012,Thu
https://www.youtube.com//watch?v=2BOTS9GAjc4,25,Let's put birth control back on the agenda | Melinda Gates,235647,3300,2302,11,4,2012,11/4/2012,Wed
https://www.youtube.com//watch?v=GcJxRqTs5nk,17,Moral behavior in animals | Frans de Waal,1774854,28000,1667,10,4,2012,10/4/2012,Tue
https://www.youtube.com//watch?v=c0H1zU2ytxA,11,Half a million secrets | Frank Warren,663322,6500,250,9,4,2012,9/4/2012,Mon
https://www.youtube.com//watch?v=O4g60zB4Un4,4,Lucy McRae: How can technology transform the human body?,133367,1300,384,6,4,2012,6/4/2012,Fri
https://www.youtube.com//watch?v=HxMGItCnINE,6,Jack Choi: On the virtual dissection table,88318,837,168,5,4,2012,5/4/2012,Thu
https://www.youtube.com//watch?v=cC0KxNeLp1E,17,The hilarious art of book design | Chip Kidd,943190,28000,1073,4,4,2012,4/4/2012,Wed
https://www.youtube.com//watch?v=t7Xr3AsBEK4,20,"Connected, but alone? | Sherry Turkle",1558949,23000,2840,4,4,2012,4/4/2012,Wed
https://www.youtube.com//watch?v=_GsDC-uy_is,4,A Taste of TED2012,109787,921,84,31,3,2012,31/3/2012,Sat
https://www.youtube.com//watch?v=C4pHP-pgwlI,6,Marco Tempest: A magical tale (with augmented reality),211701,2300,157,30,3,2012,30/3/2012,Fri
https://www.youtube.com//watch?v=QxkxcsrveLw,14,"Leymah Gbowee: Unlock the intelligence, passion, greatness of girls | TED",185648,2600,287,28,3,2012,28/3/2012,Wed
https://www.youtube.com//watch?v=V_LurJfOSiA,25,Regina Dugan: From mach-20 glider to hummingbird drone,188341,2100,461,27,3,2012,27/3/2012,Tue
https://www.youtube.com//watch?v=Sddb0Khx0yA,15,Donald Sadoway: The missing link to renewable energy,750506,12000,1523,26,3,2012,26/3/2012,Mon
https://www.youtube.com//watch?v=ddw1_3ZVjTE,15,"Billy Collins: Everyday moments, caught in time",283395,3000,153,23,3,2012,23/3/2012,Fri
https://www.youtube.com//watch?v=9B0PaSznWJE,3,"Yup, I built a nuclear fusion reactor | Taylor Wilson",698390,6400,1811,22,3,2012,22/3/2012,Thu
https://www.youtube.com//watch?v=KxDwieKpawg,19,Andrew Stanton: The clues to a great story,2366681,59000,1226,22,3,2012,22/3/2012,Thu
https://www.youtube.com//watch?v=1bnzVjOJ6NM,16,Noel Bairey Merz: The single biggest health threat women face,58113,492,199,21,3,2012,21/3/2012,Wed
https://www.youtube.com//watch?v=aIFFFGf1ZRE,20,T. Boone Pickens: Let's transform energy -- with natural gas,95733,962,397,19,3,2012,19/3/2012,Mon
https://www.youtube.com//watch?v=psN1DORYYV0,20,Listening to shame | Brené Brown,5879186,87000,1784,16,3,2012,16/3/2012,Fri
https://www.youtube.com//watch?v=GZadCj8O1-0,5,The $8 billion iPod | Rob Reid,941764,16000,832,15,3,2012,15/3/2012,Thu
https://www.youtube.com//watch?v=2MYsx6WArKY,18,"Jonathan Haidt: Religion, evolution, and the ecstasy of self-transcendence",300946,5400,895,14,3,2012,14/3/2012,Wed
https://www.youtube.com//watch?v=nw52e0dfCaA,4,A TED speaker's worst nightmare | Colin Robertson,944725,7900,1215,10,3,2012,10/3/2012,Sat
https://www.youtube.com//watch?v=n4EhJ898r-k,12,Jennifer Pahlka: Coding a better government,92900,1500,330,9,3,2012,9/3/2012,Fri
https://www.youtube.com//watch?v=fWInyaMWBY8,18,James Hansen: Why I must speak out about climate change,319609,4300,3011,7,3,2012,7/3/2012,Wed
https://www.youtube.com//watch?v=c2tOp7OxyQ8,24,Bryan Stevenson: We need to talk about an injustice | TED,1574306,32000,1520,6,3,2012,6/3/2012,Tue
https://www.youtube.com//watch?v=c0KYU2j0TM4,19,The power of introverts | Susan Cain,13567642,346000,18008,3,3,2012,3/3/2012,Sat
https://www.youtube.com//watch?v=4ErEBkj_3PY,17,Robots that fly ... and cooperate | Vijay Kumar,2140298,18000,1242,1,3,2012,1/3/2012,Thu
https://www.youtube.com//watch?v=DZT6YpCsapg,17,Paul Gilding: The Earth is full,331480,3400,1549,1,3,2012,1/3/2012,Thu
https://www.youtube.com//watch?v=BltRufe5kkI,16,Abundance is our future | Peter Diamandis,466492,7200,971,1,3,2012,1/3/2012,Thu
https://www.youtube.com//watch?v=PcDftBVDSlc,17,Paul Snelgrove: A census of the ocean,38221,548,49,28,2,2012,28/2/2012,Tue
https://www.youtube.com//watch?v=BpxVIwCbBK0,7,Why videos go viral | Kevin Allocca,781550,7400,472,28,2,2012,28/2/2012,Tue
https://www.youtube.com//watch?v=hCop3IGZH2o,12,Tan Le: My immigration story,331127,3300,394,24,2,2012,24/2/2012,Fri
https://www.youtube.com//watch?v=gzcw_02ZB1o,18,"Shlomo Benartzi: Saving for tomorrow, tomorrow",217344,1800,189,23,2,2012,23/2/2012,Thu
https://www.youtube.com//watch?v=lJGtXuCmZBM,7,Shilo Shiv Suleman: Using tech to enable dreaming,51899,814,237,23,2,2012,23/2/2012,Thu
https://www.youtube.com//watch?v=v3-ZTqj2_kw,16,Chris Bliss: Comedy is translation,59461,1000,151,21,2,2012,21/2/2012,Tue
https://www.youtube.com//watch?v=QpmsftF2We4,19,Neil MacGregor: 2600 years of history in one object,189879,2400,333,20,2,2012,20/2/2012,Mon
https://www.youtube.com//watch?v=L9_c1j9VRwE,11,Paul Conneally: Digital humanitarianism,44925,384,29,17,2,2012,17/2/2012,Fri
https://www.youtube.com//watch?v=IGadg8xHVPI,17,How do you save a shark you know nothing about? | Simon Berrow,46992,436,75,16,2,2012,16/2/2012,Thu
https://www.youtube.com//watch?v=dWZP8cUEB7Y,6,Lucien Engelen: Crowdsource your health,23717,230,33,15,2,2012,15/2/2012,Wed
https://www.youtube.com//watch?v=Y8u42OjH0ss,11,What you don't know about marriage | Jenna McCarthy,3622009,35000,5200,14,2,2012,14/2/2012,Tue
https://www.youtube.com//watch?v=X9NFPZGyDPg,18,Tyrone Hayes + Penelope Jagessar Chaffer: The toxic baby?,101667,1300,176,13,2,2012,13/2/2012,Mon
https://www.youtube.com//watch?v=mc0vhSseGk4,6,Impossible photography | Erik Johansson,1933194,17000,696,10,2,2012,10/2/2012,Fri
https://www.youtube.com//watch?v=kQa11RMCeSI,18,Jack Horner: Shape-shifting dinosaurs,1614117,27000,3068,9,2,2012,9/2/2012,Thu
https://www.youtube.com//watch?v=nItwVO9stX8,11,"Sheikha Al Mayassa: Globalizing the local, localizing the global",318920,3200,557,8,2,2012,8/2/2012,Wed
https://www.youtube.com//watch?v=X31eYIhoMNQ,17,The moral dangers of non-lethal weapons | Stephen Coleman,50879,879,209,7,2,2012,7/2/2012,Tue
https://www.youtube.com//watch?v=Zd71719_G8Y,9,Neil Burgess: How your brain tells you where you are,113375,1300,113,6,2,2012,6/2/2012,Mon
https://www.youtube.com//watch?v=gdg4mU-wuhI,19,Danny Hillis: Back to the future (of 1994),69732,1000,195,3,2,2012,3/2/2012,Fri
https://www.youtube.com//watch?v=HbUeAdVXOVc,11,Erica Frenkel: The universal anesthesia machine,57119,781,111,2,2,2012,2/2/2012,Thu
https://www.youtube.com//watch?v=fLJsdqxnZb0,12,The happy secret to better work | Shawn Achor,3697246,47000,993,2,2,2012,2/2/2012,Thu
https://www.youtube.com//watch?v=td5Ld3nURAI,15,Bill Doyle: Treating cancer with electric fields,154796,1800,272,31,1,2012,31/1/2012,Tue
https://www.youtube.com//watch?v=LjAsM1vAhW0,17,Peter van Uhm: Why I chose a gun,2998206,91000,12894,30,1,2012,30/1/2012,Mon
https://www.youtube.com//watch?v=vw5HJhIlJp4,13,"Gayle Tzemach Lemmon: Women entrepreneurs, example not exception",78822,824,271,27,1,2012,27/1/2012,Fri
https://www.youtube.com//watch?v=8rzlrItooG4,15,"Ariel Garten: Know thyself, with a brain scanner",62620,588,262,27,1,2012,27/1/2012,Fri
https://www.youtube.com//watch?v=iUbfRzxNy20,19,Brian Goldman: Doctors make mistakes. Can we talk about that?,335643,6000,404,25,1,2012,25/1/2012,Wed
https://www.youtube.com//watch?v=c6mhFgAjqwA,17,Diana Nyad: Extreme swimming with the world's most dangerous jellyfish,94402,1200,165,24,1,2012,24/1/2012,Tue
https://www.youtube.com//watch?v=OhYvDS7q_V8,15,Lisa Harouni: A primer on 3D printing,226771,2000,469,23,1,2012,23/1/2012,Mon
https://www.youtube.com//watch?v=1pq5jnM1C-A,16,Sheena Iyengar: How to make choosing easier,473321,3200,189,19,1,2012,19/1/2012,Thu
https://www.youtube.com//watch?v=9h2dF-IsH0I,14,Defend our freedom to share (or why SOPA is a bad idea) | Clay Shirky,507700,9700,829,19,1,2012,19/1/2012,Thu
https://www.youtube.com//watch?v=VM7HQ_zbdIw,9,Mikko Hypponen: Three types of online attack,94163,1600,103,18,1,2012,18/1/2012,Wed
https://www.youtube.com//watch?v=2Oe6HUgrRlQ,19,Atheism 2.0 | Alain de Botton,1229431,27000,5172,17,1,2012,17/1/2012,Tue
https://www.youtube.com//watch?v=gv1ApCmctVQ,3,Sonaar Luthra: Meet the Water Canary,23860,481,84,16,1,2012,16/1/2012,Mon
https://www.youtube.com//watch?v=Ji0EWJd-GZQ,5,"Morley sings ""Women of Hope""",34370,318,141,14,1,2012,14/1/2012,Sat
https://www.youtube.com//watch?v=WFCvkkDSfIU,9,Drew Berry: Animations of unseeable biology,2032988,48000,3939,12,1,2012,12/1/2012,Thu
https://www.youtube.com//watch?v=3lxyi_3CGrk,15,Jonas Gahr Støre: In defense of dialogue,42413,551,131,11,1,2012,11/1/2012,Wed
https://www.youtube.com//watch?v=XZ3nEK1qSkA,7,"Sebastian Wernicke: 1000 TEDTalks, 6 words",46678,592,182,6,1,2012,6/1/2012,Fri
https://www.youtube.com//watch?v=zuAj2F54bdo,18,Paddy Ashdown: The global power shift,131803,1800,381,5,1,2012,5/1/2012,Thu
https://www.youtube.com//watch?v=IHyR7p6_hn0,11,Jane Fonda: Life's third act,225439,2500,393,4,1,2012,4/1/2012,Wed
https://www.youtube.com//watch?v=J-I2eScPkEw,9,How healthy living nearly killed me | A.J. Jacobs,705700,5000,748,3,1,2012,3/1/2012,Tue
https://www.youtube.com//watch?v=1QX7aoxSTAQ,19,Alberto Cairo: There are no scraps of men,108254,1900,144,23,12,2011,23/12/2011,Fri
https://www.youtube.com//watch?v=vEli4dfAXrM,13,Karen Tse: How to stop torture,41776,559,113,22,12,2011,22/12/2011,Thu
https://www.youtube.com//watch?v=t1Z_oufuQg4,16,Daniel Goldstein: The battle between your present and future self,279951,2700,243,21,12,2011,21/12/2011,Wed
https://www.youtube.com//watch?v=Aa2JfigaNcs,10,Sheila Nirenberg: A prosthetic eye to treat blindness,96511,1400,214,20,12,2011,20/12/2011,Tue
https://www.youtube.com//watch?v=LMrzdk_YnYY,19,The quest to understand consciousness | Antonio Damasio,507767,6500,687,19,12,2011,19/12/2011,Mon
https://www.youtube.com//watch?v=CTEhgUmSrro,11,Ramona Pierson: An unexpected place of healing,43848,665,115,17,12,2011,17/12/2011,Sat
https://www.youtube.com//watch?v=ttDM6ZtLUL4,9,Homaro Cantu + Ben Roche: Cooking as alchemy,93549,1000,161,15,12,2011,15/12/2011,Thu
https://www.youtube.com//watch?v=A-QpKiU-NHo,16,Pavan Sukhdev: Put a value on nature!,98520,1200,107,15,12,2011,15/12/2011,Thu
https://www.youtube.com//watch?v=-j2XrT0QN5A,16,Quyen Nguyen: Color-coded surgery,100790,1600,148,14,12,2011,14/12/2011,Wed
https://www.youtube.com//watch?v=7UOEk-YkxdU,5,Monika Bulaj: The hidden light of Afghanistan,33258,387,89,12,12,2011,12/12/2011,Mon
https://www.youtube.com//watch?v=7shXEFuxHAA,13,Stefon Harris: There are no mistakes on the bandstand,151098,1900,163,9,12,2011,9/12/2011,Fri
https://www.youtube.com//watch?v=x4lA-M3zbdU,16,Yoav Medan: Ultrasound surgery -- healing without cuts,136530,1700,244,8,12,2011,8/12/2011,Thu
https://www.youtube.com//watch?v=xossR6eHv3I,14,Cheryl Hayashi: The magnificence of spider silk,148046,2200,216,7,12,2011,7/12/2011,Wed
https://www.youtube.com//watch?v=-Ht4qiDRZE8,16,Massive-scale online collaboration | Luis von Ahn,300548,5600,366,7,12,2011,7/12/2011,Wed
https://www.youtube.com//watch?v=ka8L1YMR88U,17,Kathryn Schulz: Don't regret regret,390613,7200,496,2,12,2011,2/12/2011,Fri
https://www.youtube.com//watch?v=bTE0MRRXNzs,16,Charles Limb: Building the musical muscle,105690,1500,159,1,12,2011,1/12/2011,Thu
https://www.youtube.com//watch?v=stngBN4hp14,17,Annie Murphy Paul: What we learn before we're born,232140,1800,153,29,11,2011,29/11/2011,Tue
https://www.youtube.com//watch?v=cMXFiYhm79g,4,Damon Horowitz: Philosophy in prison,152138,2100,219,28,11,2011,28/11/2011,Mon
https://www.youtube.com//watch?v=LnQcCgS7aPQ,19,Chris Anderson: How YouTube is driving innovation,86424,1600,181,28,11,2011,28/11/2011,Mon
https://www.youtube.com//watch?v=YhvfOlPYifY,8,A garden in my apartment | Britta Riley,1046426,11000,464,26,11,2011,26/11/2011,Sat
https://www.youtube.com//watch?v=pkZtRzc9rFQ,4,The technology of storytelling | Joe Sabia,145481,1600,237,23,11,2011,23/11/2011,Wed
https://www.youtube.com//watch?v=ACohrH64YKs,5,"Péter Fankhauser: Meet Rezero, the dancing ballbot",128257,1500,182,22,11,2011,22/11/2011,Tue
https://www.youtube.com//watch?v=rjECbQ1r-k0,14,Phil Plait: How to defend Earth from asteroids,144460,2500,330,21,11,2011,21/11/2011,Mon
https://www.youtube.com//watch?v=z9sa2ZAqHl0,8,Robin Ince: Science versus wonder?,80129,1700,229,18,11,2011,18/11/2011,Fri
https://www.youtube.com//watch?v=V48M5j-6zdE,16,Cynthia Kenyon: Experiments that hint of longer lives,90345,1300,274,17,11,2011,17/11/2011,Thu
https://www.youtube.com//watch?v=x2sT9KoII_M,15,Fly with the Jetman | Yves Rossy,7245881,21000,2191,16,11,2011,16/11/2011,Wed
https://www.youtube.com//watch?v=fKyljukBE70,9,Conception to birth -- visualized | Alexander Tsiaras,3252734,18000,1767,15,11,2011,15/11/2011,Tue
https://www.youtube.com//watch?v=ooUqOwh-2LE,12,The shared experience of absurdity | Charlie Todd,528910,7500,272,11,11,2011,11/11/2011,Fri
https://www.youtube.com//watch?v=iNPsDky1z94,15,Allan Jones: A map of the brain,152479,1600,119,10,11,2011,10/11/2011,Thu
https://www.youtube.com//watch?v=a7t61U6BBcs,12,Ben Kacyra: Ancient wonders captured in 3D,62309,964,96,9,11,2011,9/11/2011,Wed
https://www.youtube.com//watch?v=FQdQhV1yjfc,8,Aparna Rao: High-tech art (with a sense of humor),70093,1900,124,9,11,2011,9/11/2011,Wed
https://www.youtube.com//watch?v=dySwrhMQdX4,14,Martin Hanczyc: The line between life and not-life,136099,3000,863,7,11,2011,7/11/2011,Mon
https://www.youtube.com//watch?v=fZ8eyWBQmfU,6,Marco Tempest: The augmented reality of techno-magic,378242,1400,159,4,11,2011,4/11/2011,Fri
https://www.youtube.com//watch?v=7s0CpRfyYp8,20,Daniel Wolpert: The real reason for brains,303571,4800,335,3,11,2011,3/11/2011,Thu
https://www.youtube.com//watch?v=snHS-UcG--E,9,Anna Mracek Dietrich: A plane you can drive,58381,581,179,2,11,2011,2/11/2011,Wed
https://www.youtube.com//watch?v=rFAdlU2ETjU,16,"Paul Zak: Trust, morality - and oxytocin",305988,5800,447,1,11,2011,1/11/2011,Tue
https://www.youtube.com//watch?v=wAdwurHhv-I,14,"Hasan Elahi: FBI, here I am!",101982,1200,227,31,10,2011,31/10/2011,Mon
https://www.youtube.com//watch?v=cAGFKYNrQgY,18,Béatrice Coron: Stories cut from paper,66164,615,79,29,10,2011,29/10/2011,Sat
https://www.youtube.com//watch?v=wOiKRVH0nQ8,13,Jay Bradner: Open-source cancer research,56272,1100,137,27,10,2011,27/10/2011,Thu
https://www.youtube.com//watch?v=HpiZTvlWx2g,15,Malcolm Gladwell: The strange tale of the Norden bombsight,1466390,13000,2432,27,10,2011,27/10/2011,Thu
https://www.youtube.com//watch?v=cZ7LzE3u7Bw,17,How economic inequality harms societies | Richard Wilkinson,966297,11000,2510,24,10,2011,24/10/2011,Mon
https://www.youtube.com//watch?v=MbhNaj88uL4,4,Nathalie Miebach: Art made of storms,59520,541,94,21,10,2011,21/10/2011,Fri
https://www.youtube.com//watch?v=MLvwTlbj1Y8,19,"Todd Kuiken: A prosthetic arm that ""feels""",167188,1900,244,21,10,2011,21/10/2011,Fri
https://www.youtube.com//watch?v=zI0_fSD6GPY,9,Guy-Philippe Goldstein: How cyberattacks threaten real-world peace,39669,404,166,19,10,2011,19/10/2011,Wed
https://www.youtube.com//watch?v=rsuB-6-n-MM,13,Justin Hall-Tipping: Freeing energy from the grid,168741,3500,494,18,10,2011,18/10/2011,Tue
https://www.youtube.com//watch?v=6qqqVwM6bMM,19,Bunker Roy: Learning from a barefoot movement,490001,6500,318,17,10,2011,17/10/2011,Mon
https://www.youtube.com//watch?v=_7rS_d1fiUc,7,Jae Rhim Lee: My mushroom burial suit,243018,3700,473,15,10,2011,15/10/2011,Sat
https://www.youtube.com//watch?v=P_6vDLq64gE,19,How to spot a liar | Pamela Meyer,22028834,221000,15572,14,10,2011,14/10/2011,Fri
https://www.youtube.com//watch?v=sz77x05rySc,6,Ian Ritchie: The day I turned down Tim Berners-Lee,44706,514,66,12,10,2011,12/10/2011,Wed
https://www.youtube.com//watch?v=YiXd_9DFCOQ,17,Richard Seymour: How beauty feels,129880,2000,146,12,10,2011,12/10/2011,Wed
https://www.youtube.com//watch?v=cplaWsiu7Yg,18,Alison Gopnik: What do babies think?,322788,3000,244,11,10,2011,11/10/2011,Tue
https://www.youtube.com//watch?v=R5bn9EvOQVg,6,Charles Hazlewood: Trusting the ensemble,37036,192,59,8,10,2011,8/10/2011,Sat
https://www.youtube.com//watch?v=RD07GkmM2fc,11,Mike Biddle: We can recycle plastic,117982,2500,218,6,10,2011,6/10/2011,Thu
https://www.youtube.com//watch?v=L8YJtvHGeUU,6,"Less stuff, more happiness | Graham Hill",876847,9400,424,5,10,2011,5/10/2011,Wed
https://www.youtube.com//watch?v=F17_KiAZOxg,19,Finding life we can't imagine | Christoph Adami,43011,815,125,5,10,2011,5/10/2011,Wed
https://www.youtube.com//watch?v=c-sxBTNF2U8,17,Yang Lan: The generation that's remaking China,248877,2100,439,4,10,2011,4/10/2011,Tue
https://www.youtube.com//watch?v=Nx02V8GBKUs,6,Danielle de Niese: A flirtatious aria,59640,416,164,30,9,2011,30/9/2011,Fri
https://www.youtube.com//watch?v=h4MhbkWJzKk,14,Ben Goldacre: Battling Bad Science,684494,11000,628,30,9,2011,30/9/2011,Fri
https://www.youtube.com//watch?v=iRsCUJxIrVM,8,Jarreth Merz: Filming democracy in Ghana,26405,273,42,29,9,2011,29/9/2011,Thu
https://www.youtube.com//watch?v=NMr3ShT_Kl4,6,Geoff Mulgan: A short intro to the Studio School,51027,692,62,27,9,2011,27/9/2011,Tue
https://www.youtube.com//watch?v=7fx0QcHyrFk,6,"Sunni Brown: Doodlers, unite!",215480,2600,139,27,9,2011,27/9/2011,Tue
https://www.youtube.com//watch?v=sxnlvwprf_c,18,Abraham Verghese: A doctor's touch,351828,5200,186,27,9,2011,27/9/2011,Tue
https://www.youtube.com//watch?v=rHbjwH2Blfg,13,Elizabeth Murchison: Fighting a contagious cancer,47000,603,107,22,9,2011,22/9/2011,Thu
https://www.youtube.com//watch?v=uqc56GMOYWY,4,Amy Lockwood: Selling condoms in the Congo,55449,463,115,22,9,2011,22/9/2011,Thu
https://www.youtube.com//watch?v=5l4cA8zSreQ,14,What we learned from 5 million books,229899,3600,224,20,9,2011,20/9/2011,Tue
https://www.youtube.com//watch?v=xpnFeyMGUs8,20,Niall Ferguson: The 6 killer apps of prosperity,317612,3400,520,19,9,2011,19/9/2011,Mon
https://www.youtube.com//watch?v=fIqABIcKIvs,13,Lauren Zalaznick: The conscience of television,93256,831,373,17,9,2011,17/9/2011,Sat
https://www.youtube.com//watch?v=u8bsCiq6hvM,11,Richard Resnick: Welcome to the genomic revolution,216948,2500,301,15,9,2011,15/9/2011,Thu
https://www.youtube.com//watch?v=X7ui-iAp8Pc,9,Kate Hartman: The art of wearable communication,43033,590,265,15,9,2011,15/9/2011,Thu
https://www.youtube.com//watch?v=6gSwRHScq6M,18,Misha Glenny: Hire the hackers!,105540,1400,301,13,9,2011,13/9/2011,Tue
https://www.youtube.com//watch?v=UR-uWwvpn5c,19,Yasheng Huang: Does democracy stifle economic growth?,70880,995,324,12,9,2011,12/9/2011,Mon
https://www.youtube.com//watch?v=64fDIZiV-SM,4,Shake up your story | Raghava KK,68232,1100,109,9,9,2011,9/9/2011,Fri
https://www.youtube.com//watch?v=unNRCSj0igI,15,Lee Cronin: Making matter come alive,67157,972,288,9,9,2011,9/9/2011,Fri
https://www.youtube.com//watch?v=OF2N6a3t6uY,14,Sarah Kaminsky: My father the forger,44504,649,141,7,9,2011,7/9/2011,Wed
https://www.youtube.com//watch?v=rGaj2VImQec,16,Edward Tenner: Unintended consequences,42133,482,123,6,9,2011,6/9/2011,Tue
https://www.youtube.com//watch?v=dQijrruP9c4,13,Joan Halifax: Compassion and the true meaning of empathy,242545,3200,326,2,9,2011,2/9/2011,Fri
https://www.youtube.com//watch?v=emW1TQ290ec,6,Skylar Tibbits: Can we make things that make themselves?,74384,655,125,2,9,2011,2/9/2011,Fri
https://www.youtube.com//watch?v=iYwAMccbhYs,11,Julia Bacha: Pay attention to nonviolence,50981,917,321,1,9,2011,1/9/2011,Thu
https://www.youtube.com//watch?v=kU0ei9ApmsY,17,Svante Pääbo: DNA clues to our inner neanderthal,109138,1400,263,30,8,2011,30/8/2011,Tue
https://www.youtube.com//watch?v=n8Y8FK8gonc,5,Beware conflicts of interest | Dan Ariely,125987,1000,87,30,8,2011,30/8/2011,Tue
https://www.youtube.com//watch?v=fumsXEuiLyk,5,The magic of truth and lies (and iPods) | Marco Tempest,984027,9200,451,13,8,2011,13/8/2011,Sat
https://www.youtube.com//watch?v=EaY_6muHSSI,4,Finding planets around other stars | Lucianne Walkowicz,51522,726,175,12,8,2011,12/8/2011,Fri
https://www.youtube.com//watch?v=04SEzifEsGg,18,Jeremy Gilley: One day of peace,146190,1600,185,10,8,2011,10/8/2011,Wed
https://www.youtube.com//watch?v=zwjLQgNd7XM,12,Dyan deNapoli: The great penguin rescue,28263,425,93,10,8,2011,10/8/2011,Wed
https://www.youtube.com//watch?v=mjDjbJJlqZ0,10,Alex Steffen: The shareable future of cities,58630,921,98,8,8,2011,8/8/2011,Mon
https://www.youtube.com//watch?v=bHLgTUV0XWI,13,"Eve Ensler: Suddenly, my body",110345,1500,607,6,8,2011,6/8/2011,Sat
https://www.youtube.com//watch?v=FMJgZ4s2E3w,5,The demise of guys? | Philip Zimbardo,515407,5600,1316,5,8,2011,5/8/2011,Fri
https://www.youtube.com//watch?v=7JsNH7A4qM0,5,Jessica Green: Are we filtering the wrong microbes?,41916,432,69,5,8,2011,5/8/2011,Fri
https://www.youtube.com//watch?v=ImQrUjlyHUg,20,Mark Pagel: How language transformed humanity,233465,2300,393,4,8,2011,4/8/2011,Thu
https://www.youtube.com//watch?v=NaoSp4NpkGg,13,Wireless data from every light bulb | Harald Haas,786010,5900,684,2,8,2011,2/8/2011,Tue
https://www.youtube.com//watch?v=D03n5dAmBSE,5,Adam Ostrow: After your final status update,61307,659,157,1,8,2011,1/8/2011,Mon
https://www.youtube.com//watch?v=cSohjlYQI2A,8,5 ways to listen better | Julian Treasure,3799338,55000,1173,29,7,2011,29/7/2011,Fri
https://www.youtube.com//watch?v=CdxVbUja_pY,19,Josette Sheeran: Ending hunger now,93556,856,250,29,7,2011,29/7/2011,Fri
https://www.youtube.com//watch?v=RPicL1AWrs8,16,Paul Bloom: The origins of pleasure,180377,4100,183,28,7,2011,28/7/2011,Thu
https://www.youtube.com//watch?v=XyCY6mjWOPc,17,Geoffrey West: The surprising math of cities and corporations,153802,2000,182,27,7,2011,27/7/2011,Wed
https://www.youtube.com//watch?v=dwU8eavPInw,20,Rory Stewart: Time to end the war in Afghanistan,127236,2400,608,25,7,2011,25/7/2011,Mon
https://www.youtube.com//watch?v=Fg_JcKSHUtQ,6,A robot that flies like a bird | Markus Fischer,3501670,27000,2888,23,7,2011,23/7/2011,Sat
https://www.youtube.com//watch?v=TDaFwnOiKVE,15,How algorithms shape our world | Kevin Slavin,479271,5700,418,21,7,2011,21/7/2011,Thu
https://www.youtube.com//watch?v=uzKBGtf0i0M,14,"Embracing otherness, embracing myself | Thandiwe Newton",402040,6800,584,20,7,2011,20/7/2011,Wed
https://www.youtube.com//watch?v=cf3zxHuSM2Y,17,"Mikko Hypponen: Fighting viruses, defending the net",255285,4000,281,20,7,2011,20/7/2011,Wed
https://www.youtube.com//watch?v=V4sSabKqyMU,13,Nadia Al-Sakkaf: See Yemen through my eyes,84508,559,148,19,7,2011,19/7/2011,Tue
https://www.youtube.com//watch?v=K5wCfYujRdE,18,"Tim Harford: Trial, error and the God complex",315625,5300,382,15,7,2011,15/7/2011,Fri
https://www.youtube.com//watch?v=EZwxKPv1CwA,18,Maajid Nawaz: A global culture to fight extremism,102664,1800,351,14,7,2011,14/7/2011,Thu
https://www.youtube.com//watch?v=pFDoCLf96Kg,15,Rebecca MacKinnon: Let's take back the Internet!,51918,1000,202,14,7,2011,14/7/2011,Thu
https://www.youtube.com//watch?v=r_San-YZDT4,4,Nina Tandon: Caring for engineered tissue,36567,381,66,10,7,2011,10/7/2011,Sun
https://www.youtube.com//watch?v=Peu7eeGtmQ4,22,Simon Lewis: Don't take consciousness for granted,63109,889,202,8,7,2011,8/7/2011,Fri
https://www.youtube.com//watch?v=YmVZ8zXJO48,14,Jonathan Drori: The beautiful tricks of flowers,69879,1000,131,7,7,2011,7/7/2011,Thu
